{
  "schema_version": 2,
  "module": "ziwei",
  "documents": [
    "workflow.md",
    "palaces-and-stars.md",
    "sihua-and-timing.md"
  ],
  "source_policy": "只使用已检索并实际读取的知识资料；不把搜索摘要当正文，未读尾部明确标注；不转载来源表达或媒体；公开资料不等于获再分发授权；预测及超自然主张不获科学背书",
  "sources": [
    {
      "url": "https://iztro.com/learn/basis",
      "title": "紫微斗数基础",
      "accessed_at": null,
      "accessed_precision": "date",
      "topics": [
        "结构名词及与安星计算分开的阅读层次"
      ],
      "role": "knowledge",
      "extensions": {
        "legacy_group": "knowledge_sources",
        "legacy": {
          "id": "ZI-BASIS",
          "title": "紫微斗数基础",
          "url": "https://iztro.com/learn/basis",
          "publisher_or_author": "紫微研习社；iztro 文档",
          "accessed_on": "2026-10-08",
          "retrieval_method": "web_extract",
          "read_scope": "实际读取本宫、对宫、三合、三方四正、空宫、会照等术语",
          "used_for": "结构名词及与安星计算分开的阅读层次",
          "limitations": "网页属于传统文化和软件资料，非预测准确性或人格效度证据",
          "reuse_boundary": "未取得本文再分发许可；仅参考知识点并独立撰写，不转载正文或媒体",
          "copied_text_or_media": false
        }
      },
      "accessed_on": "2026-10-08",
      "accessed_reason": "Historical record contains only accessed_on (calendar date), without a time or timezone; no access instant is inferred.",
      "retrieval": {
        "status": "sections_read",
        "method": "web_extract",
        "detail": "实际读取本宫、对宫、三合、三方四正、空宫、会照等术语"
      },
      "use_for_synthesis": true,
      "notes": [
        "网页属于传统文化和软件资料，非预测准确性或人格效度证据",
        "未取得本文再分发许可；仅参考知识点并独立撰写，不转载正文或媒体"
      ]
    },
    {
      "url": "https://iztro.com/learn/palace",
      "title": "紫微斗数宫位系统",
      "accessed_at": null,
      "accessed_precision": "date",
      "topics": [
        "十二宫、身宫与结构关系；本项目新写非决定性解释"
      ],
      "role": "knowledge",
      "extensions": {
        "legacy_group": "knowledge_sources",
        "legacy": {
          "id": "ZI-PALACES",
          "title": "紫微斗数宫位系统",
          "url": "https://iztro.com/learn/palace",
          "publisher_or_author": "紫微研习社；iztro 文档",
          "accessed_on": "2026-10-08",
          "retrieval_method": "web_extract + HTTP HTML/DOM 正文",
          "read_scope": "提取返回不完整后，HTTP 读取真实 .vp-doc 全文，实际读取十二宫、身宫六落点和三方四正",
          "used_for": "十二宫、身宫与结构关系；本项目新写非决定性解释",
          "limitations": "现代作者叙述、性别和强断语不复制；数据事实和自写反思分开",
          "reuse_boundary": "未取得本文再分发许可；仅参考知识点并独立撰写，不转载正文或媒体",
          "copied_text_or_media": false
        }
      },
      "accessed_on": "2026-10-08",
      "accessed_reason": "Historical record contains only accessed_on (calendar date), without a time or timezone; no access instant is inferred.",
      "retrieval": {
        "status": "sections_read",
        "method": "web_extract + HTTP HTML/DOM 正文",
        "detail": "提取返回不完整后，HTTP 读取真实 .vp-doc 全文，实际读取十二宫、身宫六落点和三方四正"
      },
      "use_for_synthesis": true,
      "notes": [
        "现代作者叙述、性别和强断语不复制；数据事实和自写反思分开",
        "未取得本文再分发许可；仅参考知识点并独立撰写，不转载正文或媒体"
      ]
    },
    {
      "url": "https://iztro.com/learn/star",
      "title": "紫微斗数星曜系统",
      "accessed_at": null,
      "accessed_precision": "date",
      "topics": [
        "避免把安星系列误作南北斗天文分类；亮度版本需记录"
      ],
      "role": "knowledge",
      "extensions": {
        "legacy_group": "knowledge_sources",
        "legacy": {
          "id": "ZI-STARS",
          "title": "紫微斗数星曜系统",
          "url": "https://iztro.com/learn/star",
          "publisher_or_author": "紫微研习社；iztro 文档",
          "accessed_on": "2026-10-08",
          "retrieval_method": "web_extract",
          "read_scope": "实际读取十四主星的两个安星系列、辅星分类、庙旺等级差异",
          "used_for": "避免把安星系列误作南北斗天文分类；亮度版本需记录",
          "limitations": "未完整逐宫校验亮度表，因此本项目不提供固定庙旺全表或数值命分",
          "reuse_boundary": "未取得本文再分发许可；仅参考知识点并独立撰写，不转载正文或媒体",
          "copied_text_or_media": false
        }
      },
      "accessed_on": "2026-10-08",
      "accessed_reason": "Historical record contains only accessed_on (calendar date), without a time or timezone; no access instant is inferred.",
      "retrieval": {
        "status": "sections_read",
        "method": "web_extract",
        "detail": "实际读取十四主星的两个安星系列、辅星分类、庙旺等级差异"
      },
      "use_for_synthesis": true,
      "notes": [
        "未完整逐宫校验亮度表，因此本项目不提供固定庙旺全表或数值命分",
        "未取得本文再分发许可；仅参考知识点并独立撰写，不转载正文或媒体"
      ]
    },
    {
      "url": "https://iztro.com/learn/major-star",
      "title": "十四主星",
      "accessed_at": null,
      "accessed_precision": "date",
      "topics": [
        "主星名称与通行文化主题；所有用户向反思表达独立编写"
      ],
      "role": "knowledge",
      "extensions": {
        "legacy_group": "knowledge_sources",
        "legacy": {
          "id": "ZI-MAJOR-STARS",
          "title": "十四主星",
          "url": "https://iztro.com/learn/major-star",
          "publisher_or_author": "紫微研习社；iztro 文档",
          "accessed_on": "2026-10-08",
          "retrieval_method": "web_extract",
          "read_scope": "实际读取所有十四主星单节和相关组合的资料，按标题检查完整覆盖",
          "used_for": "主星名称与通行文化主题；所有用户向反思表达独立编写",
          "limitations": "原网页统计概率、人格定性和外貌/道德判断不采用；不转载其人物类比或组合故事",
          "reuse_boundary": "未取得本文再分发许可；仅参考知识点并独立撰写，不转载正文或媒体",
          "copied_text_or_media": false
        }
      },
      "accessed_on": "2026-10-08",
      "accessed_reason": "Historical record contains only accessed_on (calendar date), without a time or timezone; no access instant is inferred.",
      "retrieval": {
        "status": "sections_read",
        "method": "web_extract",
        "detail": "实际读取所有十四主星单节和相关组合的资料，按标题检查完整覆盖"
      },
      "use_for_synthesis": true,
      "notes": [
        "原网页统计概率、人格定性和外貌/道德判断不采用；不转载其人物类比或组合故事",
        "未取得本文再分发许可；仅参考知识点并独立撰写，不转载正文或媒体"
      ]
    },
    {
      "url": "https://iztro.com/learn/mutagen",
      "title": "紫微斗数四化",
      "accessed_at": null,
      "accessed_precision": "date",
      "topics": [
        "明确采用该文自述全书系通行版本，不称所有流派唯一标准"
      ],
      "role": "knowledge",
      "extensions": {
        "legacy_group": "knowledge_sources",
        "legacy": {
          "id": "ZI-SIHUA",
          "title": "紫微斗数四化",
          "url": "https://iztro.com/learn/mutagen",
          "publisher_or_author": "紫微研习社；iztro 文档",
          "accessed_on": "2026-10-08",
          "retrieval_method": "web_extract",
          "read_scope": "实际读取四化类型、层次、宫干飞化及完整十天干表，包括甲至癸十行",
          "used_for": "明确采用该文自述全书系通行版本，不称所有流派唯一标准",
          "limitations": "没有逐页核对古籍刻本，作者归属与具体版本仅按文档自述；表为传统对应知识，叙述与比喻不复制",
          "reuse_boundary": "未取得本文再分发许可；仅参考知识点并独立撰写，不转载正文或媒体",
          "copied_text_or_media": false
        }
      },
      "accessed_on": "2026-10-08",
      "accessed_reason": "Historical record contains only accessed_on (calendar date), without a time or timezone; no access instant is inferred.",
      "retrieval": {
        "status": "sections_read",
        "method": "web_extract",
        "detail": "实际读取四化类型、层次、宫干飞化及完整十天干表，包括甲至癸十行"
      },
      "use_for_synthesis": true,
      "notes": [
        "没有逐页核对古籍刻本，作者归属与具体版本仅按文档自述；表为传统对应知识，叙述与比喻不复制",
        "未取得本文再分发许可；仅参考知识点并独立撰写，不转载正文或媒体"
      ]
    },
    {
      "url": "https://iztro.com/posts/config-n-plugin",
      "title": "配置和插件",
      "accessed_at": null,
      "accessed_precision": "date",
      "topics": [
        "年界、换日与规则配置存在差异；软件示例不等于流派标准"
      ],
      "role": "knowledge",
      "extensions": {
        "legacy_group": "knowledge_sources",
        "legacy": {
          "id": "ZI-CONFIG",
          "title": "配置和插件",
          "url": "https://iztro.com/posts/config-n-plugin",
          "publisher_or_author": "紫微研习社；iztro 文档",
          "accessed_on": "2026-10-08",
          "retrieval_method": "web_extract",
          "read_scope": "实际读取 yearDivide、horoscopeDivide、ageDivide、dayDivide、algorithm 及可自定义四化/亮度说明",
          "used_for": "年界、换日与规则配置存在差异；软件示例不等于流派标准",
          "limitations": "仅阅读文档，没有在本项目安装或执行 iztro，也不声称完成本地排盘",
          "reuse_boundary": "未取得本文再分发许可；仅参考知识点并独立撰写，不转载正文或媒体",
          "copied_text_or_media": false
        }
      },
      "accessed_on": "2026-10-08",
      "accessed_reason": "Historical record contains only accessed_on (calendar date), without a time or timezone; no access instant is inferred.",
      "retrieval": {
        "status": "sections_read",
        "method": "web_extract",
        "detail": "实际读取 yearDivide、horoscopeDivide、ageDivide、dayDivide、algorithm 及可自定义四化/亮度说明"
      },
      "use_for_synthesis": true,
      "notes": [
        "仅阅读文档，没有在本项目安装或执行 iztro，也不声称完成本地排盘",
        "未取得本文再分发许可；仅参考知识点并独立撰写，不转载正文或媒体"
      ]
    },
    {
      "url": "https://iztro.com/quick-start",
      "title": "iztro 官方文档：获取星盘数据及方法定义",
      "accessed_at": null,
      "accessed_precision": "date",
      "topics": [
        "区分实际闰月与软件处理，设计原创接入数据结构"
      ],
      "role": "knowledge",
      "extensions": {
        "legacy_group": "knowledge_sources",
        "legacy": {
          "id": "ZI-QUICKSTART",
          "title": "iztro 官方文档：获取星盘数据及方法定义",
          "url": "https://iztro.com/quick-start",
          "publisher_or_author": "紫微研习社；iztro 文档",
          "accessed_on": "2026-10-08",
          "retrieval_method": "web_extract",
          "read_scope": "实际读取 bySolar/byLunar 数据与完整参数说明，特别是 isLeapMonth、fixLeap、时辰序号及外部盘层字段",
          "used_for": "区分实际闰月与软件处理，设计原创接入数据结构",
          "limitations": "仅学习接口概念，不复制代码或软件演示盘为用户实际盘；参数规则须以实际版本核对",
          "reuse_boundary": "未取得本文再分发许可；仅参考知识点并独立撰写，不转载正文或媒体",
          "copied_text_or_media": false
        }
      },
      "accessed_on": "2026-10-08",
      "accessed_reason": "Historical record contains only accessed_on (calendar date), without a time or timezone; no access instant is inferred.",
      "retrieval": {
        "status": "sections_read",
        "method": "web_extract",
        "detail": "实际读取 bySolar/byLunar 数据与完整参数说明，特别是 isLeapMonth、fixLeap、时辰序号及外部盘层字段"
      },
      "use_for_synthesis": true,
      "notes": [
        "仅学习接口概念，不复制代码或软件演示盘为用户实际盘；参数规则须以实际版本核对",
        "未取得本文再分发许可；仅参考知识点并独立撰写，不转载正文或媒体"
      ]
    },
    {
      "url": "https://iztro.com/learn/horoscope",
      "title": "紫微斗数运限",